{
  "_note": "Fictional sample data for the ql-charts demo. Not real market data.",
  "symbol": "ACME",
  "yield": 2.15,
  "growthYears": 9,
  "annual": [
    [
      2016,
      0.92
    ],
    [
      2017,
      0.98
    ],
    [
      2018,
      1.05
    ],
    [
      2019,
      1.12
    ],
    [
      2020,
      1.18
    ],
    [
      2021,
      1.26
    ],
    [
      2022,
      1.36
    ],
    [
      2023,
      1.44
    ],
    [
      2024,
      1.55
    ],
    [
      2025,
      1.66
    ],
    [
      "TTM",
      1.71,
      true
    ]
  ]
}
